{
  "eventId": "019bd5c3-5f42-7d83-9c2a-6d7e8f9a0b12",
  "occurredAt": "2026-09-09T05:22:47.8810000+00:00",
  "aggregateId": "019bd4a0-7b22-7a53-96e4-2f3a4b5c6d7e",
  "organisationId": "019bcf7f-9d10-7b21-84c6-5e7f8a9b0c1d",
  "templateVersionId": "019bd29d-3b84-7d16-8e37-8b9c0d1e2f3a",
  "templateCode": "MT_BLOUSE_PATTERN",
  "versionNumber": 2,
  "templateStillPublishable": true,
  "eventType": "customers.measurement-template-version-retired.v1",
  "schemaVersion": 1
}
